,title,score,is_self,selftext,created_utc,num_comments,timestamp
364,"Yale lecture, ""Biology and the History of abortion""(link and summary inside): ""Life does not begin at conception, life is a continuous cycle""",12,True,"[link](https://www.youtube.com/watch?v=nnbni3d2UTg&list=PLE60A08636F41C128&index=23)

I have paraphrased most of his lecture, but I recommend downloading this lecture to iTunes university on your phone (its free) and listening to it while walking or driving so you don't get bored. 

Lecture by Professor Robert Wyman

""So the abortion debate is 'when does life begin?'. Luckily that is a question that biology can say something about. 


What statement is the most common statement made on this? Usually that life begins with conception. 

Quote by George Will ""It is a biological fact, not a theological postulate that such life is a continuum from life until death""

[he goes on to quote some else(?) who stated that all basic biology text books say this:] ""A fetus is a human being distinct from, while dependent on its mother. It deserves the full protection of its rights. ""

[Wyman] That isn't at all what a biology text book says. A biology text book shoes something quite different; it shows life as a cycle. There is no start point. Fertilization is just one of the events going around the cycle. This is the essence of sexual reproduction. 

The cycle is a switch between a haploid (one copy of each chromosome) and a diploid (two copies of each chromosome). In sexual reproduction there is always some version of this one copy, two copy reproduction. 

[he goes on to explain sexual and asexual reproduction: fun fact, strawberries reproduction asexually!] 



""the whole phrasing of this debate of when does life begin is a cultural hold over from the many centuries ago when there was no scientific understanding. So the question, 'when does life begin?', well, what is the alternative to it being a cycle of life, to something that is not alive? ...that would be called spontaneous generation.""

He says what made people think spontaneous generation was how life began was from observing a caterpillar that transforms into a moth. People believed caterpillars formed a cocoon and died inside of it (turning into a nutrition goo), and from that a butterfly would form....Human life, he says, was presume to be made from menstrual blood. From this he relates the current assumption that life has a beginning and an end; that life comes from ""not-life"", when in fact, life is a continual cycle. Because fertilization is the final constitution of the set up of a fetus, people assume that this is where ""not-life"" becomes uniquely ""life"".

[he goes on to explain how a ""the final genetic constitution is not set until some time *after* fertilization] He uses calico cats as an example, explaining how they have big black patches and big orange patches. ""What you're seeing is, at a certain point in development there will be one cell with two sets of genes, one will have the melanin gene which will make the patch black, and the other will make it orange""  He says in one cell the gene for orange might turn off and you'll get a black patch, or vice versa. He says the number of patches can tell you at what cell stage this process happened, because each of those patches are the descendant of a single cell.


[next he goes on to discuss development] He says development is a very ""chancie"" process. He says 78% percent of fertilized conceptions ""die"", and the mother will not even know she is pregnant because this usually happens in the first few weeks of  the pregnancy. He points out that religious folk who believe humans come back from death in the body in which they died, must also believe that a fetus enters heaven in a test tube. He says you it takes, on average, 5 months to get pregnant. He explains a scenario where a woman tries for 5 months to get pregnant and asks, well what is happening in the other 4 months? The sciences says the woman is getting pregnant each month, but the fetus doesn't make it past the first few weeks, so it is not noticeable. If pro-lifers believe that life begins at conception, then this is a tragedy! When a person dies there has to be a death certificate, an inquest; for example, did the mother drink alcohol, or smoke, or do something to cause her fetus to die? And if she did, should she be tried? He also says that even after birth, there is a possibility that the child will still die in the first few years (he says something like 1/3 of births)

In sum, ""it is a very chancie procedure, and elimination occurs along every step of the way""

[next he talks about ""when does life begin"" according to various cultures] 

Some examples:

• after infant mortality, that is, after a person has surpassed the point where it is most likely to die

• From the Milani of West Africa, Nigeria: after 7 days, an infant is considered a life 

• the Navajo in America don't consider the child to be a ""life"" until the child laughs for the first tine

• some believe life begins with movement
**""The point is that cultures have a different take on when life begins; since life is a cycle, they have this right, because where it begins is arbitrary""**

•""Even within culture, the take on where life begins is very different"" for example, he says his friends (obstetricians and gynecologists) believe life begins at implantation, when the embryo attaches to the uterine wall. 

•He also says neonatologists often argue that the start of life is when the baby becomes viable 

• **He says neurologists (he is a neurobiologist, and agrees with this point) believe that a life begins when it has some mental capacity. This might mean motor response, brain waves, the ability to sense something, or when it can feel pain. He says only by the 7th month are the neuro-pathways able to send this information to the cortex, but there is no evidence that the cortex even does anything with this information.**

He says all science can do explain the process of development; it cannot decide, nor does it care, when people believe ""life"" truly begins. 


**[he goes on to talk about how the law has to define murder] ""The law likes a bright-white line, so that it is clear to everybody when you have crossed this line."" Since there is much debate from the point of fertilization to birth, the clearest line is at or near birth. No one will argue this point, and thus it is the most obvious answer in the eyes of the law.**


[next he chooses to talk about biblical definitions of life] 

The old testament: He says God created man in his image, and the first life he create was a full grown man, not a baby. 

The new testament: Says nothing about when life begins. The new testament and the roman empire coexisted, and at this time abortion was not uncommon.

The sixth commandment: thou shall not kill. What does this mean? The testament explains how to handle various situations (can I kill my slave, a thief, etc) and describes a scenario where a man beats another mans pregnant wife resulting in here miscarriage. The suggested way of handling this situation is to decide, in front of a judge, an appropriate monetary amount for compensation; this is the same as how cases of stolen property where handled. However, if further injury to the mother occurs, they may ""take life for life, eye for eye, tooth for tooth"". He claims that this is very revealing that the miscarriage is not considered murder, and the inclusion of the word ""tooth"", automatically excluded a fetus or baby from person hood. 





He finishes off by explaining how the concept of ""soul"" formed from Aristotle's interpretation of how life began. Aristotle believed the mother provided the genetic material, but the father (with his sperm), provided the soul. Finally, at the discovery of fertilization (1840s) the concept of a ""soul"" was still imbedded in our society. Thus, when we discovered the point at which the human began to form, we naturally believed this fetus had a soul. **The modern day belief that a fetus is ""new life"" worthy of rights and so on is either a certainty by religious pro-lifers (because it has a soul) or it is a lingering assumption by secular pro-lifers who have it ingrained in their minds (even subconsciously) that it is, in a sense, sacred, simply because it belongs to the human species.**",1491086913,12,2017-04-01 18:48:33
369,Looking for Pro-Choice opinions on the Pro-Life movement!,1,True,"Hey everyone!

I am conducting some research on the relationship between the Pro-Choice and Pro-Life movements in the US, and I would love your feedback. I am essentially studying how each group feels about the other group, and how these relations influence policy work in regards to abortion. How do you feel about the Pro-Life movement? What frustrates you, and what do you wish Pro-Life supporters understood better?

I believe a better understanding of the dynamic between these two (often incredibly polarized) groups can contribute to more cooperative work when it comes to the creation of policy and activism in the US.  If you agree or disagree, I would also love to hear what you have to say.

If you'd like to offer any feedback, I'm collecting completely anonymous responses on this form below:
https://docs.google.com/forms/d/e/1FAIpQLSfYOfZRdQ5lmhJWAViVmcUyqdPE00gtiN13nWE2htcWJT4LXA/viewform?usp=sf_link
Of course, I'd also appreciate anyone who just wants to comment their opinions here. Thanks for your time!",1490893522,17,2017-03-30 13:05:22
370,searching for chicago women who have had an abortion,6,True,"and want to share their story as part of a photojournalism project for a magazine. interested in all ages, races and ethnicities from all types of backgrounds and upbringings.

must be willing to share details of their decision, procedure/appointments and their feelings before, during and afterwards.

looking for women who are both happy and unhappy with the decision they made. must be willing to be photographed, as well.

please message me if you are one of these women or if you know one of them who would be interested in this project.

thank you!",1490883718,3,2017-03-30 10:21:58
371,I'm looking for a list of anti-choice/pro-birth websites that are generally fact free.,17,True,Something I can book mark when someone tries to use them in a discussion.,1490835650,1,2017-03-29 21:00:50
374,Pro-Choice Student Film Seeking Funding,1,True,[removed],1490618405,1,2017-03-27 08:40:05
376,Possible holes in my arguments?,9,True,"I am pro choice and do come up with a few arguments. Sometimes pro-lifers counter with some arguments to which I have no answer to, and I would love it if someone could help me out. In other words, if you would like to, help me answer the counter.
1. If I were to starve myself, and the fetus dies, this proves that it is my body, my choice. Counter: If a mom stops feeding a child, it's her choice to not take any action to feed the child. That of course is murder due to negligence.
2. Just like with coma patients, the 'feeder' has the right pull the plug. Counter: Again, same with the mom refuses to feed child.
3. A dead body has more rights than a pregnant women. Counter: Pretty much the same thing as 1 and 2.
Thanks for your help in advance! ",1490482248,14,2017-03-25 18:50:48
380,Why Abortion is Wrong,1,True,[deleted],1489970085,0,2017-03-19 20:34:45
383,"In the U.S., are there any changes being made to how late a woman can get an abortion? I'm concerned...",22,True,"I heard today from someone that Trump is trying to lower the weeks a woman is allowed to get an abortion. I did some googling but all I can find is information on what he did about the Hyde Ammendment. 

Have any of you heard this too or is it just a rumor? I'm very concerned about what choices women will be left with their bodies by the end of his presidency... :/",1489715256,14,2017-03-16 21:47:36
384,"My girlfiend says she would want to keep the baby if there are congential problems discovered by screening, I would want an abortion because of the increased challenges for me as a parent. How do we resolve this?",5,True,"She isn't pregnant (yet, as far as we know) but she asked what it would mean if she didn't change my mind, or I didn't change hers. And I would simply not have unprotected sex with her, because if I had a disabled child I would take care of that child, but I would prefer not to have them if I could in advance. 

We are both open minded and have some background in science (unrelated to abortion!). We figure that sorting these issues out earlier will prevent us getting too emotional about it needless close to an 'emergency'.",1489713535,10,2017-03-16 21:18:55
385,Would you support abortion if we had the technology to take a fertilized embryo and produce a human without the need of a female host?,8,True,,1489712284,14,2017-03-16 20:58:04
387,What are your thoughts on this pro-choice argument?,5,True,"In addition to the personhood argument, this is the pro-choice argument which I am tempted to view as the best one; basically, it's a four-point argument:

1. As a general rule, killing someone in self-defense is morally justifiable.
2. Existence *isn't* worse than non-existence.
3. Thus, conceiving an embryo/fetus (and thus shifting its state from non-existence to existence) *shouldn't* generate any obligation towards this embryo/fetus on your part.
4. Thus, killing this embryo/fetus in self-defense (via abortion) is morally justifiable.

Any thoughts on this? After all, I am tempted to view this argument as more convincing that a straight-up ""bodily autonomy is/should be absolute"" argument (which even I myself *don't* fullyaccept).",1489524675,30,2017-03-14 16:51:15
390,"The ""forced organ donation"" argument backfires.",3,True,"I'm the kind of person who analyzes arguments in favor of the things I support to make sure they're sound. I found the forced organ donation argument compelling for awhile. However, after giving it more thought, I found that it seems to backfire. By backfire I mean it would actually be an argument that helps anti choicers.    
    
Before I give my reasons I'll give the forced donation argument for those who are unfamiliar. It says that we are not allowed to force a woman to donate an organ to her dying child. Therefore we cannot force a woman to carry a pregnancy to term to save the life of the fetus or zygote. Now I'll give my argument for why it backfires.  To be clear though I'll only be referring to consensual sex here.   
    
Imagine that you, of your own free will, decide to engage in an activity. In carrying out this activity you damage my liver to the point where I need an organ transplant. You are the only person capable of donating to me in time. It is true that no one can force you to do it, but if I die you would likely be charged with some form of negligence resulting in death, or manslaughter.    
    
Now consider pregnancy in light of my analogy above. A woman freely decides to engage in sex, and as a result she gets pregnant. No one can force her to carry to term, but terminating the pregnancy would be a crime. This is because, like my earlier example, the fetus needing her organs to survive is a direct result of a free action taken by the woman.    
    
The anti choicers could argue that the fetus needing your organs would be no different than if you accidentally damaged my liver. While you can't be forced to donate an organ you can still be charged with a crime if the person dies because you were directly responsible for them needing the organ(s) to survive.     
    
This is the reason why I decided it's a bad argument because using it actually gives ammunition to those who wish to criminalize abortion. Thoughts?",1489110698,42,2017-03-09 20:51:38
393,"The House's new healthcare bill specifically prohibits Planned Parenthood from funding, via a special definition",38,True,"Check this out. They're sneaking an anti-Planned Parenthood provision into the bill. Note that it isn't merely anti-abortion, which is also in the bill, but this part is specifically anti-Planned Parenthood, they wrote the definition so that no other healthcare organization matches it.

http://www.cnn.com/2017/03/06/politics/house-republicans-obamacare-repeal-replace-text/index.html

> (b) DEFINITIONS.—In this section:

> (1) PROHIBITED   ENTITY.—The term ‘‘prohibited entity’’ means an entity, including its affiliates, subsidiaries, successors, and clinics—

> (A) that, as of the date of enactment of this Act—

> (i) is an organization described in section 501(c)(3) of the Internal Revenue Code of 1986 and exempt from tax under section 501(a) of such Code;

> (ii) is an essential community provider described in section 156.235 of title 45, Code of Federal Regulations (as in effect on the date of enactment of this Act), that is primarily engaged in family planning services, reproductive health, and related medical care; and

> (iii) provides for abortions, other than an abortion—

> (I) if the pregnancy is the result of an act of rape or incest; or 

> (II) in the case where a woman suffers from a physical disorder, physical injury, or physical illness that would, as certified by a physician, place the woman in danger of death unless an abortion is performed, including a life-endangering physical condition caused by or arising from the pregnancy itself; and 

> (B) for which the total amount of Federal and State expenditures under the Medicaid program under title XIX of the Social Security Act in fiscal year 2014 made directly to the entity and to any affiliates, subsidiaries, successors, or clinics of the entity, or made to the entity and to any affiliates, subsidiaries, successors, or clinics of the entity as part of a nationwide health care provider network, exceeded $350,000,000. ",1488864054,0,2017-03-07 00:20:54
402,Question on the validity of a source.,4,True,"Hey there, I hope this isnt against the rules even though ive read them, I may have missed something. But recently I have been seeing my pro-choice friends sharing this article http://springsbury.com/nurses-share-heartbreaking-stories-of-what-happens-to-babies-who-survive-abortions/ 

My one question here is if this Nurse Kathleen Malloy is even a real person. (Using the full name because article is using her quote.) Ive done google searches on the name and the only relevant results that come up are to websites that use the quote. But nothing on her. Being a RN id think there'd be a picture of this 'hero' who is exposing the 'atrocities' of 'big abortion'. But who knows, I may just be garbage at research. Im not trying to dox or harass this person in anyway, Im just genuinely curious if this is a real person. Nothing on Snopes comes up either.  Big thanks if someone can point me in the right direction.",1488079790,4,2017-02-25 22:29:50
406,"Had the U.S. Supreme Court imposed a limit of 12 weeks rather than viability for the right to abortion, do you think that the abortion issue would have been much less controversial in the U.S.?",12,True,"Basically, this one pro-lifer has told me (on another website) that she believes that the reason that abortion is such a heated issue in the U.S. is because the U.S.'s abortion laws are extreme in comparison to most European countries. Specifically, she told me that if the U.S.'s abortion laws were more similar to Europe's abortion laws--at least in regards to the approximate 12 week limit for elective abortions--the abortion issue would be *much* less controversial here in the U.S. because, in her opinion, people have much more sympathy for older fetuses than for embryos and younger fetuses.

Anyway, do you agree with this pro-lifer's statement in regards to this or not?

Any thoughts on this?",1487875542,10,2017-02-23 13:45:42
407,I posted in r/prolife about the link between racism and black infant mortality rates,15,True,"Apparently indirectly killing babies is a-ok, institutionalized racism isn't real, and caring about the lives of black babies would distract from the all important fetuses. I am disgusted and needed to vent.",1487830336,31,2017-02-23 01:12:16
411,Intellectually Honest Abortion Debate Suggestions,3,True,"Hello r/prochoice, I am seeking to find a straight up earnest and intellectually honest debate regarding abortion and would LOVE your help. It seems like every Youtube debate is titled somewhere along the lines of ""Pro-lifer Gets Fucking Destroyed"" or ""Watch Murderous Pro-choice Advocate Go Down in Flames"" and it's just plain irritating.


I am just looking for a well reasoned, non/less rhetorically laden conversation between two sides that attempts to use reason and integrity in fleshing out the moral complexities of each side. What have you got for me?",1487720027,15,2017-02-21 18:33:47
412,Do you support the legalization of *all* medical procedures as long as they are completely consensual?,0,True,"Basically, a pro-lifer can argue that abortion bans are no worse than, say, physician-assisted suicide bans due to the fact that both of these bans prevent you from doing something which your body.

Thus, my question to you is this--do you support the legalization of *all* medical procedures as long as they are completely consensual?

Basically, I am curious about this considering that a critic of legalized abortion (and of Roe v. Wade, of course) could argue that there is no logic in, say, keeping physician-assisted suicide and whatnot illegal while having abortion be legal.

Anyway, any thoughts on this?",1487706727,36,2017-02-21 14:52:07
413,So I just tried to have a conversation with a pro-lifer...,23,True,"...and it went way worse than expected.

I say ""conversation"", but it was via IM. I messaged a woman asking her what she thought of a story recently posted on here about a man who lost his wife in childbirth because they chose not to have an abortion despite knowing how dangerous her condition was (a choice which was very much influenced by aggressive protesters at planned parenthood pushing the idea that abortion is always murder).  I simply asked the woman whether after reading that story she still felt that it is ""always"" murder. 

She wouldn't even read it, at all. She simply accused me of trying to ""swindle"" her, refused to even have a calm conversation about it, and started saying I was ""probably one of those baby killers too"". She completely flipped on me, and I was as absolutely polite the entire time. I never even told her my own beliefs, I simply asked her a question. 

I'm just very frustrated that people like her are running around loudly proclaiming anyone who believes in pro choice or even supports planned parenthood is a ""baby killer"". It's just nothing but negativity and violence with a complete inability to even try and talk things out. If she wants to convince people of her point of view, I would gladly chat with her, but instead she chooses to spam Facebook with proclamations in both her comments and posts of ""DEFUND PLANNED PARENTHOOD"" and ""ABORTION IS MURDER"". She even said, and I quote, ""Why are you trying to change my way of thinking so I will supporting ripping babies legs and arms and crushing their skull"" ""This is how they do abortions. Watch silent scream""

I'm just infuriated. She puts no thought into the things she's spewing, she just repeats what others have told her. Argh. 

Sorry, I'm just ranting. I've never had an encounter like this before, and the ignorance made me sick to my stomach. Feel free to share any similar stories you have, maybe one of you has more experience with keeping a civil conversation with people like this.",1487657351,14,2017-02-21 01:09:11
414,In Seattle traveling with work - in need of travel help to Planned Parenthood,7,True,"This may be the wrong subreddit, however I thought I could start here. I have an appointment in the morning tomorrow and my escort/transportation fell through very last minute. I need an escort to sign me in and out after my procedure and am extremely concerned that I won't have one and will be turned away tomorrow. This appointment is serendipity, because it's one of the few weeks in my work schedule I'm in one state for a week, rather than only two days. It was also one of the last open appointments. 

My family is in another state and my lovely boyfriend is across the country, I don't have anyone that I trust to ask for help and was wondering if anyone had an ideas for my situation? I would greatly appreciate any advice. ",1487644774,5,2017-02-20 21:39:34
416,Can someone send me an abortion pill?,13,True,I live in Nova Scotia and I don't have access to an abortion pill. Mifegymiso is available in Canada now but not in my province yet. Is there anyone out there who could mail me some? Abortions are incredibly difficult to get here and I'm running out of options... if someone is willing to help we can work out a payment through e-transfer.,1487614730,6,2017-02-20 13:18:50
