,title,score,is_self,selftext,created_utc,num_comments,timestamp
476,Opinion/Change My View: Roe v. Wade was wrongly decided and should be overturned,0,True,"Frankly, this is an issue which I appear to be conflicted on. However, in spite of my own support for legalized abortion nationwide, I am becoming hesitant to say that doing this through the judiciary/courts was the right move.

Basically, while I certainly consider the arguments against legalized abortion (and forcing unwilling parents to pay child support in cases where taxpayer money isn't on the line, for that matter) to be very weak (indeed, I certainly think that it is ridiculous to impose an *involuntary* obligation on someone in response to this person doing either a *morally neutral* (such as causing a zygote/embryo to exist) or a *morally positive* action), I certainly understand why exactly even a secular, non-religious person can be politically anti-abortion. Thus, rather than legalizing abortion through the judiciary/courts, I am gradually becoming tempted to say that abortion is an issue that should have been left to the political process to deal with.

For the record, in regards to bodily autonomy, I myself have *never* considered bodily autonomy to be a ""holy cow"" (in spite of my own politically pro-choice position). Indeed, I myself have no problem with laws that, say, give convicted criminals a choice between refusing to donate their body part(s) to their (living, obviously) victims (or to another needy person in the event that there is no match with the victim's body parts) and getting more jail time or agreeing to donate their body part(s) and getting less jail time. Plus, we already *don't* fully treat bodily autonomy as a ""holy cow""--else, things such as drug use, consensual incest, consensual prostitution, et cetera would already be legal. (For the record, I myself actually *would* support using the judiciary to legalize things such as consensual incest nationwide. After all, if women who are over, say, age 35 are able to have children in spite of the apparently higher risk of birth defects, why exactly should consensual incestuous adult couples be unable to likewise have children (let alone consensual sex)?)

Basically, a problem that I have with using the courts/judiciary to legalize abortion nationwide is that while things such as drug use *indisputably* only *directly* affect *one* person, this certainly *isn't* true of abortion. (Do *I* consider non-sentient embryos and non-sentient fetuses to be persons? No, certainly not! However, I am hesitant to say that this is something that should be imposed on the entire U.S. by the courts/judiciary.) Thus, the courts/judiciary should let the various U.S. states (well, in the absence of a U.S. Constitutional amendment in regards to this, that is) make their own moral judgments in regards to whether or not a pregnant woman's bodily autonomy is superior to an embryo's/fetus's life.

Also, I would like to point out that, as far as I know, the U.S. government *can* draft unwilling people and thus force unwilling people to risk their lives, say, fighting an unprovoked war of aggression against out democratic neighbors Canada and Mexico. Indeed, in spite of my support for the doctrine of implied repeal (after all, if judges overreach, then they can simply be impeached and removed from office and then have their rulings be overturned/repealed by their replacements), I am hesitant to say that the courts/judiciary (meaning the U.S. Supreme Court) should strike down the draft in my scenario above. Likewise, I am hesitant to say that the courts/judiciary should continue to uphold Roe v. Wade. After all, in spite of my own pro-choice political views, I appear to be gradually coming to the conclusion that controversial issues that *don't* indisputably involve only *one* party should be left to the U.S. states (in the absence of a U.S. Constitutional amendment in regards to this, obviously; also, for the record, I myself would certainly *support* a U.S. Constitutional amendment which legalizes abortion nationwide in the U.S.).

Anyway, any thoughts on what I wrote here?",1469368108,47,2016-07-24 09:48:28
477,There's a NGO that wants to create reversible vasectomies,15,True,"[The Parsemus Foundation](https://www.parsemusfoundation.org/) is apparently trying to create a reversible alternative to vasectomies called [Vasalgel](https://www.parsemusfoundation.org/projects/vasalgel/); a gel they inject to block the sperm

I thought maybe this sub would find it interesting?",1469275146,11,2016-07-23 07:59:06
482,"How to argue the pro-choice side, IMO",4,True,"I've spent a lot of time arguing about abortion, both on and off Reddit and other forums, and in my experience here is the best way to go about making the case for abortion:

First, you have to make sure they understand the issue is a ""lesser of two evils"" situation. It helps if they know that you don't particularly like abortions, that you would prefer to prevent unplanned pregnancies before they happened rather than resort to abortion. They have to understand that you feel that abortion is a ""necessary evil"" (even if you don't feel this way, it goes a LONG way toward coming to common ground and establishing credibility in the pro-life person's mind). You have to get them to see that there IS a victim on the other side... the woman who is pregnant and doesn't want to be.

Second, you must explain what it is that confers something that philosophers call ""full moral status"" (or FMS) onto a being in question. To do this first you should explain what is NOT relevant to the consideration of moral status. You must dispel with the notions that merely belonging to a species (human, DNA) is enough to confer full moral status, that being ""alive"" is relevant only as a prerequisite for that which is actually important (which I'll get to in a moment, for this I like to use the phrase ""necessary but not sufficient"". That is, being alive is necessary but not sufficient for FMS) and that things like the heart beating and having recognizable body structures (facial features, fingers and toes) are completely irrelevant to the issue and are nothing but emotional appeals. Quickly and without prejudice dispel any appeals to any subjectively defined classifications (""alive"", ""human"", etc) and explain that they are, indeed, subjectively defined human invented systems of classification and that the property which confers full moral status (which I sometimes like to call moral worth or moral consideration) is a real, objective, property that might happen to fall under one or more of those categories of things that they bring up but is not equivalent to them.

Next, explain that the property that actually matters to the application of morality is sentience. A being is sentient if it has subjective experiences. A subjective experience is an experience that is private to that being, it is something that gives that being a perspective of it's own. We do not apply morality to ANYTHING that is not sentient, and for good reason. Explain that sentience is a prerequisite for empathy, it makes no sense to feel bad for a rock that is struck by a hammer, but it does make sense to feel bad for a dog that is struck by a hammer, and the difference is the property of sentience in the dog that is absent in the rock. Sentience is what allows for ALL experiences, including the experience of suffering and pleasure, pain and joy, happiness and sadness... not all sentient beings are capable of all of these things, but not all of them are required for a being to have moral worth. When they inevitably ask about when a fetus gains sentience and how he know refer them to this journal article of research that seeks to answer exactly that:

http://www.tandfonline.com/doi/abs/10.3109/14767059209161911

The short answer is we aren't sure but 18 weeks is a lower bound due to the development of requisite structure in the brain.

Sentience is the only real property of a being that matters to the issue when considering that beings perspective (because perspective itself requires sentience). If they want to argue about loss to society or negative psychological effects on the mother that is a completely different issue and I could offer some tips as well but in my experience this only comes up rarely... usually they are focused on the fetus.

If you agree and feel like it, I also find that extending a compromise goes a long way. I would accept a compromise of banning abortions after 16 weeks (less than 18 to acknowledge the potential for errors in our understanding) rather than what most of them are seeking: A full blown ban on abortion in general. It's up to you whether you could support that position or not...

---

Here is another good article to refer them to which provides an overview of the philosophical positions on the issue of Full Moral Status:

http://plato.stanford.edu/entries/grounds-moral-status/

This quote from the article is VERY useful:

>whether one belongs to a given species depends on biological criteria, such as whom one can mate with, whom one is born of, or having the relevant DNA. But it is unclear why these biological criteria are relevant for moral status. The point can be sharpened this way. The human species, for example, is a morally relevant category because the species is characterized, in part, by morally relevant properties such as sophisticated intellectual and emotional capacities, and not merely by biological criteria (e.g., mating abilities). But it is unclear why a token member of a species, a token lacking any of these morally relevant capacities, should get the moral status from the type it belongs to (the species). If membership in the type does not require any of the morally relevant features, how can the membership be morally relevant? ",1468855442,30,2016-07-18 11:24:02
485,How do I reply to this?,10,True,"I read it and digesting it, but I've been kind of busy. How do I reply to this?



""I want abortion completely abolished and the women who attempt it (and survive) to be tried for murder and go to prison. I want the doctors and nurses who help them to be shipped off to remote gulags for their crimes against humanity. 

I'm not here to barter on what level of abortion is socially acceptable. I'm a liberal's worst nightmare and completely unapologetic about it.

Now, I don't know what crazy tree you're cherry picking your data from, but on the whole, around a million-point-two babies are aborted every year in the United States.

I don't care if we see a 5% drop year-over-year in legal abortion. The fact remains that we're still shuttling over 3,000 babies into the suction-blender every day - and have been since the passage of Roe V. Wade.

Of course, accurate mortality data before Roe V. Wade is hard to find, but prior to the law, it's estimated that 200,000 abortions were performed each year. That's over a 5X increase since the law was passed.

The levels of reduction you're talking about are a drop in the bucket and unacceptable to someone like me, who is looking to salt the earth and start over. 

I'm looking for a complete reversal of course. Turn the ship around and go back the other way - like Russia is doing right now. Do whatever it takes to change the law of the land.

The only acceptable case - ever - would be for the preservation of the life of the mother - and here the guiding principle is the same as being anti-abortion - that of preserving life. But those cases are so incredibly rare that it's basically a non-issue.""

Then he linked this article:

https://www.lifesitenews.com/news/russian-parliamentarian-proposes-near-total-ban-on-abortion-but-will-it-pas
",1468449182,7,2016-07-13 18:33:02
491,Hypothetical abortion legal question/scenario,2,True,"Based on my discussion here:

https://www.reddit.com/r/changemyview/comments/4s3cse/cmv_the_14th_amendment_implicitly_repealed_the/

I was wondering about this--if, purely hypothetically, the original U.S. Constitution would have prohibited elective abortion nationwide at *any* stage of pregnancy, and you would have been a judge on the U.S. Supreme Court in the late 20th century who would have had to determine the legality of abortion, would you have argued that the U.S. Constitution itself makes abortion illegal? Or would you have argued that the (hypothetical) part of the U.S. Constitution which makes abortion illegal was *implicitly* repealed by later U.S. Constitutional Amendments, such as by the 13th Amendment and/or 14th Amendment?

Indeed, any thoughts on this? After all, I am wondering as to how exactly you would have ruled in such a scenario.

Also, for the record, assume that you would have believed (at the time that you would have needed to make this ruling) that abortion was unlikely to become legalized nationwide in the U.S. (or anywhere in the U.S., for that matter) through a U.S. Constitutional Amendment (due to the lack of necessary support), which in turn would have meant that many additional women would have probably been injured and/or died in ""back-alley"" abortion attempts over the next several decades if the U.S. Supreme Court *wouldn't* have legalized abortion nationwide in the U.S. *right now.*",1468192736,0,2016-07-10 19:18:56
492,"Here is a bit of news, good and bad, from Poland.",12,True,"Hello everyone.           
For goodies skip the introduction.          
A year after the elections a grim reality of having a right-wing government leaning towards orthodox catholic teaching is becoming a source of real fear. We find ourselves defending regulations from the 90s - cool and progressive by the standard of 70s - broadly described as a ~compromise.          
Recently a pro life organization (Fundacja Pro, mildly connected with Ordo Iuris) submitted a project of new regulations with over 500k signatures gathered to the sound of a broken record and displays gross posters all across the country.       
On Thursday, July 7th, we were collecting signatures next to the theatre of Juliusz Słowacki in Krakow with Kazimiera Szczuka (a well spoken jurnalist) under an alternative project (campaign Ratujmy Kobiety). With the deadline set to July 31st and 30k signatures below minimal safe number around 110-120k we pick a spot previously occupied by pro life movement. Harvest ensues.        
           
Goodies in more or less chronological order.          
•	Soon after we started around 1300 several older ladies approach us, while one of them is filling in her ID number she says to the other ‘mom are you going to sign?’, ‘yes, of course’ she responds – from the ID number I read (upside down) the fine year of 1934 when she was born. Another one – a tourist from Warsaw, couldn’t sign at Pride back home. Many more like her stop by.           
•	1400 – first wave of people leaving work is passing by, many of them endured a month of pro-life records played in the underground passage leading to the train station. They rarely ask questions before signing. Maria, our coordinator was wearing a yellow T-shirt and at first some of them thought we were from that other organization. Seeing people rolling hard and fast like a tank to get away just to make a U-turn when they realize something is different … priceless.
•	1500 – News spread like wildfire. Lots of people decided to avoid traffic by using bikes, they just stop, say ‘Hi’, pick a board, sign and ride back home. Each of us is carrying two boards with lists and we can’t keep up. At that time when somebody was rolling at me like a tank I just extend a hand holding board, form and a pencil, several pencils ran out of ink.           
•	1600 – An angry, rabid prolifer learns it is not a good idea to call a megaphone holding journalist a whore. Threatens to call the police, whatever. An older man came with his grandchildren, figured ‘They can learn something with me’ Comments like ‘Mom/wife/brother told me to stop by’ became increasingly common.         
•	1700 – People don’t just sign, they bring full lists from work. Batteries in the megaphone ran out but we continue for another hour.         
•	1800 – We are done for the day, waiting for 300 more signatures from non-government organizations and resting on a bench. City Guards stop by, it turns out using audio equipment in cultural park around the old city requires permission. Batteries in megaphone ran out of juice so they couldn’t confirm complaint  they received, too bad that they wouldn’t sign while on duty.             
             
Bonus – some personal observations:        
It is strange but older folks, born in 1950s or early 60s were very interested in signing the project, just as much as young generation but then there is a gap of people who are now 40-50 years old.         
If you ever intend to do this bring extra pencils, put a small poster on the back of your board that can be recognized.         
Don’t get into a heated debate on the street, it’s a waste of time.",1468062698,1,2016-07-09 07:11:38
494,OSU research: Do you have a story of contraceptive or abortion injustice to share?,7,True,"My name is Kate, and I am a student working with my advisor in the College of Public Health at The Ohio State University. I am conducting a research study to better understand women’s experiences in seeking contraception (pills, condoms, IUDs, shots, etc.) or abortion care. I am looking for women who are willing to confidentially share their stories. I will interview women at least 18 years of age who tried to get contraception services or abortion care in the last two years but were turned away because of the personal views of the provider (doctor, nurse, pharmacist, receptionist, etc.) The interview will take about 20-45 minutes to complete. You won’t have to give me your name, and I will keep your responses confidential. To compensate for the time needed for the interview, I will give three months of Reddit gold (value of $7.98) to all eligible women who complete the interview. To my knowledge this is Reddit history: the first time researchers have used Reddit to find women to do a study. To learn more about my project, please private message me at kolsfu_10.",1467938361,3,2016-07-07 20:39:21
498,Write-up of the Sarah Brown case from a credible source?,1,True,"In a debate, someone linked me to a Life News article about ""abortion survivor"" Sarah Brown, a five-year-old who allegedly died from complications after being born alive during a very late-term and allegedly completely elective abortion. I tried to do further research, but I could not find any information on the case other than from pro-life rags and *shudder* The Daily Mail. I was wondering if anyone has any credible background information on this case, as none of the articles I could find went into any detail about the situation of the mother and why she sought an abortion (all just implied that she simply ""felt like it"" at 36 weeks, which of course leaves me highly skeptical) or described the situation in an unbiased, neutral reporting style. Does anyone have any intellectually honest information on this case?",1467825908,9,2016-07-06 13:25:08
431,Hypothetical question about artificial wombs and the legality of abortion,0,True,"Out of curiosity--if there was some way to transfer unwanted non-viable prenates (embryos and fetuses) from women's wombs to artificial wombs, and if doing this was *more* dangerous for these women than getting an abortion is, would you support keeping abortion legal nationwide to the extent that you would support a U.S. Supreme Court ruling imposing this view of yours on the *entire* U.S. (as in, on *all* U.S. states)? Or do you think that it should be a states' rights issue in such a scenario?

Anyway, any thoughts on this?",1467771002,15,2016-07-05 22:10:02
437,Abortion test,0,True,How bout if you are willing to kill a puppy you can get an abortion.,1467436218,14,2016-07-02 01:10:18
441,NARAL Blog features an interview with a NC Chaplain on being pro-choice.,2,True,"I wanted to share my boyfriend's interview on being a Chaplain and his stance on being pro-choice that was picked up my the NC Reproductive Rights group.

[Article here!](https://prochoicenc.wordpress.com/2016/06/18/qa-with-alan-hamm-pro-choice-chaplain-and-crisis-counselor/)

Hope this post is ok! I'm incredibly proud of his and NARAL's efforts in NC for reproductive rights!",1467339086,0,2016-06-30 22:11:26
442,Question about pro-choice and morality,0,True,"Hi, just curious about what some thoughts on morality and pro-choice may be. I feel like the question of ""should it be legal?"" is discussed constantly, but the question of ""is it moral?"" seems rarely asked.

Do you think an abortion is always moral? Never Moral? Or it changes based on circumstances?

Also, would it be moral for someone to abort their child if they don't like what gender it will be, or what color eyes it will have?",1467308706,51,2016-06-30 13:45:06
443,how to argue pro choice??,6,True,"i was arguing with a friend today who is very pro-life. i said that the children-to-be are just clusters of cells that are fully dependent on their mother, and that if a mother doesn't want a cluster of cells to feed off of her nutrients, then she has the right to remove it. he said ""so people who are dependent on machines to live just deserve to die?""


what do you think??",1467143728,11,2016-06-28 15:55:28
448,"5-3, Texas' HB2 has been struck down, the ruling of the Fifth Circuit has been reversed",39,True,,1467036494,10,2016-06-27 10:08:14
450,Two reasons why you can think abortion is immoral but remain steadfastly pro-choice,21,True,"(1) The essence of pro-choice is that no one view on the morality of abortion applies universally; you may believe that abortion is immoral, but you also acknowledge that your personal view should not control another person's life

(2) Abortion may be immoral, but using the law to deprive a woman the right to decide her reproductive future is even more immoral",1466994184,100,2016-06-26 22:23:04
451,"Two reasons why you can believe abortion is immoral, yet remain pro-choice",1,True,[deleted],1466993337,0,2016-06-26 22:08:57
454,"If sexual orientation can be determined before birth, would you support the mother's choice to abort her baby because it's not straight?",0,True,[deleted],1466700452,2,2016-06-23 12:47:32
461,Question on Sex-Selective Abortion,0,True,[deleted],1466305784,230,2016-06-18 23:09:44
465,"The pro-life movement isn't about saving lives, it's about regulating sex for women",47,True,"I found this really interesting blog post written by a former 'pro lifer'. It's a pretty long post, but the gist of it is that the movement isn't about saving life, it's about dictating to women when they are permitted to have sex, or in other words, it's anti-sex. The post points out that by increasing birth control availability, you dramatically reduce abortions since women abort unwanted pregnancies. So, if pro-lifers were truly concerned about saving lives, they would be working towards ensuring that women have easy and affordable access to birth control to prevent the unwanted pregnancy in the first place. But, pro-lifers don't want that. Their solution is abstinence or marriage....

Has anyone else come to the same conclusion as this blogger? Her conclusions are really reasonable and she makes great points. It makes so much more sense...

Here's the link to the blog: [How I lost faith in the pro-life movement](http://www.patheos.com/blogs/lovejoyfeminism/2012/10/how-i-lost-faith-in-the-pro-life-movement.html)",1466187292,16,2016-06-17 14:14:52
466,"Pro-life isn't about saving the lives of babies, it's about regulating sex for women",1,True,[deleted],1466186670,0,2016-06-17 14:04:30
467,"[Discussion] I'm Pro-Choice, Anti-Abortion",0,True,[deleted],1466120247,87,2016-06-16 19:37:27
473,Are the Democrats demonstrably better for Women's Abortion rights?,2,True,"Hello, I'm very new to your subreddit. I had a conversation with a very left leaning friend the other day who thinks there isn't much of a difference between dems and repubs when it comes to abortion rights. She feels Democrats are mostly talk, and will only do the barest minimum - they aren't aggressive or sincere enough in their efforts. I thought this seemed suspicious. I wanted to do some research into the Democratic parties history on abortion rights, and I was hoping some of you here could give me your opinion on this. Are the Dems demonstrably better for abortion rights?",1465737975,3,2016-06-12 09:26:15
477,"I keep hearing that abortion procedures are the safest medical procedures, but there is something I don't understand.",0,True,[deleted],1465504373,0,2016-06-09 16:32:53
482,Please help me,15,True,I need an abortion right away. I'm out of time. Everytime I call the hotline for assistance it is busy. I do not have a car to drive myself and I am 2 1/2 hours from a clinic. I know asking strangers on the internet is crazy but I'm desperate and I'm really running out of time,1465311055,3,2016-06-07 10:50:55
486,ctrl alt delete | Seed & Spark: A new seriocomic series trying to talk about abortion without stigma,8,True,"Check it out. Throw in a few bucks for the crowdfunding campaign if you can.  Check out the show later if you can't:

https://www.seedandspark.com/studio/ctrl-alt-delete#wishlist",1464993565,0,2016-06-03 18:39:25
