,title,score,is_self,selftext,created_utc,num_comments,timestamp
287,"When do you think abortion is immoral/should be illegal, and why do you draw the line there?",0,True,"Personally I understand why people draw the line when the baby is born alive or has a heart beat. But where do you draw the line and more importantly why?

update: do you really feel that way? consider it carefully. If I were pro choice I'd be for the viability rule, and I understand the pro choice point of view.

OK, why do you draw the line where you do?",1509388871,26,2017-10-30 14:41:11
291,"So I'm neither pro-life or pro-choice. But I wanted to ask the people here, when do you think the cut off point should be on abortions?",0,True,"Im honestly curious. I think I err closer to the classical conservative view on abortion. I don't think, outside of some specific conditions, people should be getting abortions. 

Not because I believe they are inherently wrong, but I have no idea when a fetus is alive. And I, and I believe most of you, are opposed to actually killing a live child. 

When does the mass of cells in the womb considered a child and should not be allowed to be aborted? And if you don't mind, what's your logic for your answer? ",1509121083,107,2017-10-27 12:18:03
294,Is this a good prochoice argument or not?,1,True,"&gt;Abortion is wrong because it takes away the potential of a human life,

&gt;Not combining all of our sperm and egg cells takes away the potentials of many human lives,

&gt;Therefore we should combine all of our sperm and egg cells so that no potential human lives will be lost.

It's showing that if you think human life is valuable enough to not kill it in the embryo stage, then you shouldn't kill any sperm or egg cells either because they could potentially produce human lives if they were combined.",1508961457,26,2017-10-25 15:57:37
301,When does the life of a Human Being begin? The EEG (Brain Birth) argument.,1,True,"Greetings all. I am just a lurker wondering if anyone of you have heard of the EEG argument on when a human being begins. I think it serves to really further the scientific end of our case. Basically, it states that a human being is not formed till higher brain activity. As quoted by the JM Goldenring the original author of this idea: ""The brain enables our body, our mind, our personality. The brain is the only unique and irreplaceable organ in the human body, as the orchestrator of all organ systems and the seat of personality. Thus, the presence or absence of brain life truly defines the presence or absence of human life in the medical sense. When viewed in this way, human life may be seen as a continuous spectrum between the onset of brain life in utero until the occurrence of brain death. “At any point, human tissue or organ systems may be present, but without the presence of a functional human brain, these do not constitute a 'human being', at least in a medical sense.” 
https://www.ncbi.nlm.nih.gov/pubmed/4078859

Now at what point would we say the fetus has reached significant brain activity to be considered a human being so to say? Numerous Scientists have put it at around 28 to 32 week as this when the fetus develops significant brain function that differentiates us from animals.

http://www.nytimes.com/1975/05/09/archives/fetal-brain-said-to-live-at-28-weeks-role-of-the-brain-studies.html
http://articles.latimes.com/1990-03-19/local/me-476_1_brain-stem

So basically based on this idea we can see that the fetus reaches the brain birth criteria to become a human being at around 28 to 31 weeks. Now if we look at Abortion Data we will find that abortions happening beyond 21 weeks represent less than 1.3% of abortions. I would wager that abortions happening in the 28-31 week range are literally non-existent and the abortions that do happen this far are almost always of the case where the mother's life is in danger, or they are medically necessary.
https://www.cdc.gov/mmwr/preview/mmwrhtml/ss6410a1.htm
http://reason.com/blog/2016/10/21/late-term-abortions-in-america-2016

I could elaborate more, but what do you all think? Is this a reasonable argument we can add to our arsenal along with the concept of bodily autonomy? I certainly think so based on the science behind it. 
",1508043601,37,2017-10-15 01:00:01
304,Howdy I am a conflicted pro-choicer and was hoping y'all would be able to help me through these thoughts.,1,True,"So to put this simply I agree with abortion simply because I am a guy (22 yrs) I can't fathom raising a child unprepared or in a situation where the woman was raped, and it's not the governments place to tell you what to do with your body. Now here is where the conflict comes into play I believe as soon as the zygote is formed and successfully starts growing you have life. That is a fully living and growing cell that if it is allowed to grow uninhibited and given proper nutrients will be baby in a several months. I'm not the most moral person and have come to terms with the amorality of it and how others view when life starts. Recently I have been thinking about the right to exist. A friend of mine is an abortion survivor and I found myself reflecting on the book unwind and the Casey Anthony trial. I am wondering as people do we have a right to deny other people's existence before they are even allowed to exist? And in the case of Casey Anthony if she would of just had an abortion it would be a completely different circumstances while kind of having he same result (no kid).  With Unwind it got me thinking that if the fetus could fight against the abortion then would they? I am not going to change my pro-choice stance, but I feel like I need to discuss these thoughts.",1507819236,11,2017-10-12 10:40:36
305,"Boston Globe Opinion Piece, featuring: Sexist Garbage!",3,True,"https://www.bostonglobe.com/opinion/editorials/2017/10/10/you-can-pay-for-aspirin-you-can-pay-for-birth-control/Mskwsd0JlGmZImshgG3ozI/story.html

*HIGHLIGHTS!*  
Where ""highlights"" = bits and pieces I found particularly ridiculous. All *emphases* mine, all [bracketed comments] mine. Please read the linked article so you have the full context for my commentary. :)  The excerpts begin below:


The freedom to use birth control is protected by the Constitution’s “fundamental right” to privacy. That freedom is a matter of settled law, and *hasn’t been challenged in the slightest by President Trump or his administration*.


Elizabeth Warren, denouncing “this attack on basic health care,” claimed the GOP’s top priority is to deprive women of birth control. “News flash to Republicans,” Warren sneered. [Every paragraph in this entire piece could be followed with ""Jacoby sneered"".] “The year is 2017, not 1917.”

News flash to Warren, et al.: There is no attack on health care [lolwut?], and no one in America is being deprived of birth control [LOLWUT???]. You are losing nothing but the power to force nuns to pay for your oral contraceptives. [What about the nuns that support free contraceptives?  Or the ones that aren't offended by the idea of such a thing? Also, is it just me or is this just another way of screeching ""Taxation is theft!!!""?]

As a matter of economics and public policy, the Affordable Care Act mandate that birth control be supplied for free is absurd. [Citation Needed.]

In carving out an exemption to the ACA mandate for *employers with genuine moral qualms*, the Trump administration is belatedly halting *five years’ worth of bullying* by the federal government.

It is disturbing to see “reproductive rights” hardliners react with such fury to treating nuns with respect and sensitivity. [Yep, we ""reproductive rights"" hardliners sure do hate treating nuns with respect and sensitivity (...Citaion Needed???).] *Especially since birth control will remain as available and affordable as ever.* [Solid gold toilet seats also remain as available and affordable as ever...for the people who can afford them regardless of government assistance.]

It is true that a woman’s unwanted pregnancy can lead to serious costs, but the same is also true of a diabetic’s hyperglycemia. Should insulin be free? [Yes. Universal health care would be lovely, thanks. Our Emergency-Room-only health care is a pretty shit system. What's wrong with wanting a system where everyone has access to appropriate preventative, maintenance, and emergency care?]

By and large, *birth control is inexpensive*; as little as $20 a month without insurance. For low-income women who find that too onerous [Jacoby sneered], the federal government’s Title X program provides subsidized contraception to the tune of nearly $290 million per year. [That...that doesn't actually tell us the degree to which the low-income woman's financial burden is alleviated...]

[Concluding Paragraph]
The White House is right to end the *burden* on religious objectors. But it is the birth-control mandate itself that should be scrapped. *Contraception is legal, cheap, and available everywhere.* [ORLY???] Why are the feds meddling where they aren’t needed? [Ah just fuck everything in this paragraph.]

Edit: Fixed link",1507797992,5,2017-10-12 04:46:32
307,Pro-Choice Rhetoric and Reasoning,0,True,"Hello, Reddit's pro-choice community. Although I'm pro-life, I would like to contribute on this subreddit and ask the occasional question. I look forward to our discussions.

Sometimes we pro-lifers hear flawed or poorly ariculated arguments in defense of our own position. I assume this happens to you as well. Which pro-choice arguments do you personally find the least logical or least persuasive, and why?",1507782650,7,2017-10-12 00:30:50
314,What are the problems with a 20 week abortion ban?,5,True,"I have an inkling why it is problematic, but I was hoping someone could solidify my knowledge by listing what the medical, political, and social justice issues are with the ban.

Thanks.
 ",1507218540,6,2017-10-05 11:49:00
320,"Are you Pro-Life? Great, we need to talk!",2,True,[deleted],1507126394,1,2017-10-04 10:13:14
322,"Discussion Question: Would you consider a compromise, where abortion is made illegal, in return for sufficient support for mothers and children?",0,True,"Would you consider making abortion illegal in most cases, the cases where a mother feels the child will be inconvenient. The details such as allowances for health to the mother, etc. could be negotiable? 

In exchange would be sufficient support for mothers and children. Support includes coverage of medical procedures related to pregnancy, support for food, maternity leave, sufficient schooling, other costs relating to raising the kid, etc. 

Would there be any amount of support that you do compromise, and would support making most abortion illegal?",1507072712,232,2017-10-03 19:18:32
328,Planned Parenthood and the baby scrapyard?,2,True,"Ok, I know this is a ticklish subject, but I have to know: Does PP actually sell fetus remains for medical research? I don't have a problem with it, but it seems a lot of people do. Also, I need to know if that related secretly taped interview was a con job, too. The one where the PP heads are laughing about the money they're making from selling fetus cadavers. Just curious.",1506400942,6,2017-09-26 00:42:22
334,Have you guys heard of some pro-lifer's calling Margaret Sanger a racist and eugenicist?,18,True,My pro-life group on campus is trying to pull people in by asking people if they want to help eliminate racial genocide. They go on about how Margaret Sanger started Planned Parenthood with support of the KKK to reduce the black population. I've tried to look stuff up about her in the aspect of pro-choice but I can't find anything.,1505441510,9,2017-09-14 22:11:50
335,A fetus does not have the right to life until it survives pregnancy!,8,True,Why is this so freaking hard for people to grasp? The woman has rights over the fetus before it is born.,1505371408,27,2017-09-14 02:43:28
336,I'm pro life but...,2,True,"I recently saw a post on r/dataisbeautiful about how most liberal and conservatives stick to their own groups of posting and sharing ideas and don't venture out very far into any opposing views. Where I see the appeal to that approach as I'm surrounding myself with people that agree with me, I do believe we are capable (myself and whoever chooses to as well) of having a civil discussion where we discuss differences of beliefs and opinions. 

My goal here is not to be antagonistic at all and I apologize as a male that I can not and will not ever understand the pressure, and complexity many woman face in regards to unplanned pregnancy. But at the core of my question is the question of life, is the fetus, specimen, tissue (whatever we call it) alive, human, sentient?

I'm curious as to the philosophical, theological, and scientific proof that backs your opinion. 

(I put philosophical for those ho don have scientific research but are solid in their opinion based on logic) 

(I put theological because I've seen almost every religious group come down hard on both sides, individually at least) 

(I put scientifically because it in essence is a question of biology)

TL:DR respectfully is an unborn fetus human? And proof.",1504996714,112,2017-09-09 18:38:34
341,Im a character designer and i want to make a pro choice poster. Help?,9,True,my friend is running an exhibition with the theme being choice. I not really sure what to make for it ideally id like it to be funny while making you think so i thought id ask people here who are better educated in this than i,1504701427,1,2017-09-06 08:37:07
343,Here is Why Abortion is Wrong,0,True,[removed],1504541687,11,2017-09-04 12:14:47
345,Saw this guy at a city parade.,18,True,"[Here is the guy](https://imgur.com/gallery/uVsxL), he stood there with his sign and when people said they didn't want their children seeing it, he said 'all people need to see this, men, women, and children'. Seriously, fuck that guy, a little girl was so disturbed by the sign that she started crying, and even if there weren't children, there is a time, place, and way to start a discussion, at a city parade holding a graphic sign whilst being a dick and calling everyone there horrible for saying he should leave because people are just here to have a good time is not the time, place, or way",1504401131,23,2017-09-02 21:12:11
346,Need an abortion but affected by Hurricane Harvey? Whole Woman's Health is offering free services.,42,True,"https://twitter.com/wholewomans/status/903719375269752832

Tweet:
We're offering NO-COST abortions to those affected by #HurricaneHarvey Call us: 877.835.1090 to see how we can help",1504323206,4,2017-09-01 23:33:26
347,Arguing With Hypothetical Moral Dilemmas,10,True,"So I noticed this post yesterday (https://www.reddit.com/r/prochoice/comments/6wd261/hi_i_am_a_prolifer_i_wrote_a_piece_about_why_i_am/?st=J7199KPK&amp;amp;amp;sh=a04be077) and reading through it and the comments I realized how useful it is to use hypothetical moral dilemmas to expose the logical inconsistency of abortion prohibitionist principles without challenging their often inadequate definitions of ""life,"" ""rights,"" ""humanity,"" etc.


I don't know about other people here, but typically when I debate an abortion prohibitionist I will challenge their definitions rather than directly testing the limits of their moral assertions and ethnical framework. I'm thinking now that the latter might produce better results because when I challenge definitions often times the person will get hung up on defining humans by human DNA, failing to understand that that is a circular definition which ignores the fact that evolution changes the genome overtime invalidating it as a metric by which humanity can be universally defined accross time (and thus invalidating any universal moral argument against killing humans) as well as failing to understand that a resulting undesirable logical consequence of defining human beings by the genome is that people with chromosomal abnormalities end up being classified as sub-human.


I call it the ""house on fire"" dilemma, and it takes the following framework:


There is a house on fire. In one room is a jar of X embryos that can/will be implanted in a uterus to be developed into a human baby. In the other room is an actual baby. Or a person's loved one. Or even a dog. It could be any number of things, you can change up what is in the room as you see fit. Heck you might even have the second room be a pregnant woman since they seem to romanticise pregnancy so much. You can only save one. Which do you save and why?


I haven't completely thought through the implications of the different choices, but so far it seems to me that if they choose to save the embryos (because they outnumber the people in the other room) then they invalidate the ability to experience pain (as well as personhood) as a relevant property of moral value. They thus cannot assert that abortion is wrong because a fetus can feel pain. On the other hand, if they choose to save the living entity in the second room, then they implicitly demonstrate that things which possess sentience and personhood have greater value than unborn embryos. Thus they ultimately cannot equate abortion to murder.


Another scenario I thought of is the ""end all abortions button."" You can replace the embryos in the house on fire with the ""end all abortions button,"" or you can ask the person whether or not they would press the button if it meant they would die. I haven't really thought through the implications of this latter scenario yet. If you press the button you're pretty much an ideological lunatic. If you don't press the button you don't really believe abortion is a moral travesty, especially one worth dying for. I'm thinking this question could probably be modified to be more extreme. Perhaps the ""end all abortions button"" kills everyone who has A) gotten an abortion B) performed an abortion or C) defended abortion or is pro-choice. I don't know.

What are your thoughts on these hypothetical scenarios? Are there any other hypothetical scenarios or analogies that you regularly use when you debate these people?


Below is the comment chain where I tried this for the first time if you are interested.

https://www.reddit.com/r/prochoice/comments/6wd261/comment/dmd55e0?st=J71AV1E5&amp;amp;amp;sh=5faece78


[Edit: another hypothetical I have used in the past is your mother/sister/wife/daughter was raped and wants an abortion. They are also suicidal and state that they would rather kill themselves than give birth. Do you support them in getting an abortion and do you believe you, they, or the doctor should be punished for doing so? Depending on how they answer the question this could reveal anything from sociopathy to contradicting the premise that rape is not a valid reason to kill someone.]",1504235274,20,2017-08-31 23:07:54
349,"I just got in a Facebook argument with like a dozen Pro-Lifers - why are they so ridiculous and annoying? Why do they value the potential life over a cluster of cells and tissue, over the life and choice of a an actual grown human being? I'm so frustrated.",22,True,Of*,1504064458,27,2017-08-29 23:40:58
