,title,score,is_self,selftext,created_utc,num_comments,timestamp
4,Today's the Black Friday!,8,True,"If you've seen [the post I've written recently]
 (https://www.reddit.com/r/prochoice/comments/7u3zkf/the_black_protests_in_poland/) , then you know what's going on in Poland. Radical abortion bans, protests, petitions... One of them passed. The *bad* one. The radical abortion limit. And now it's almost there, close to be implemented...

So the feminists and the pro-choice in general are protesting like they did in 2016, '17, and in January this year.

They are rallying in the city streets against the repressive ban, today, right now, as I'm writing!

I'm watching the Warsaw livestream on Facebook and wearing black clothes as a sign of solidarity with them right now.

Couldn't come to the protest but still trying to show my support...",1521821586,2,2018-03-23 12:13:06
7,I asked a Pro-Lifer if they would support a gun ban if it was to save the lives of children,3,True,"Here's how the conversation went down:

""Why do you want the black market to provide abortion care in this country?﻿""

Her:
""It will be extremely painful... for you. Their punishment must be more severe.﻿""

Me:

""Yea, so then why does Mexico which has abortion banned average 34 abortions per 1,000 pregnancies, while the US which has legalized abortion, only has 13 abortions per 1,000 pregnancies?

You care deeply about the lives of children. You're a very empathetic person in that sense. That's good. *Would you be willing to pass gun bans if it were to save the lives of children as well?*﻿""

Her:
""Banning guns would actually make kids less safe, because then only criminals would have them. Banning abortions, even partially, would save lives. *Bans are for violence, guns are not violence, they are tools.* Killing an unborn human without the ability to speak for itself is an unspeakable act of violence. Your argument is total garbage.﻿""

Me: ""Yea, well Europe, Japan, Australia and Canada don't seem to have the same problem with school shootings that our country does. So clearly they're doing something right, and we're doing something wrong.

"" Bans are for violence, guns are not violence, they are tools."" Lol what? Yea, they're tools for killing. That's why every infantry soldier is equipped with one when they enter a war zone. 

Banning abortion would make women less safe. We already have the highest maternal death rate in the developed world. The ultimate goal of the Pro-Life community is to make that even worse, since they'll be turning over women's abortion care to the black market, instead of it being performed by licensed medical doctors.

If you can claim gun bans don't work, then it's not hard to see that neither would abortion bans.﻿""",1521738905,22,2018-03-22 13:15:05
10,Pro-Lifer With a Question,2,True,"All cards on the table, I’m not expecting to change your minds about this.  On the flip side, I doubt that you will change my mind.  That being said, I’m genuinely curious about your ideas and arguments, even if I don’t agree.  


So, here goes.  


On the pro-life side, abortion discussion revolves a lot around when a fetus becomes human.  I get the impression that on the pro-choice side the discussion tends to focus more on the social ramifications of unplanned pregnancy.  Some very important points need to be made about social ramifications, but since I come from “the other side” I was hoping I could get a pro-choice perspective on the human life question.  
I know there’s a spectrum of ideas out there about when a fetus becomes human and gains human rights.  At the moment the legal landscape tends to grant human rights at either “viability” or birth.  However, the time of birth and the point of viability vary from fetus to fetus depending on external factors like the health of the mother and the technology level of the society.  In other words, weather or not a fetus is legally human depends on where and when it is, not what it is.  Is a late term fetus more human today because we have the technology to save it than the same fetus would have been in antiquity?  More broadly, what should be the legal foundation for granting human rights?    


This seems like a key point to me, but obviously you guys have a different perspective, so let me know how you see this question.  ",1521675496,139,2018-03-21 19:38:16
12,Attending a funeral for a miscarriage?,5,True,"Just curious. Would you ever attend a funeral for a miscarriage, even an early term one? Why or why not?",1521654392,30,2018-03-21 13:46:32
13,If when you get pregnant... it isnt't considered a baby.. Why can only one person get a choice if it comes one?,1,True,[deleted],1521622203,0,2018-03-21 04:50:03
17,"I'm pro choice, but I think there should be a line drawn.",0,True,[deleted],1521607141,10,2018-03-21 00:39:01
20,Help me refine my abortion position,0,True,"Hi all,

I currently believe the following:

-Abortion is killing a life
-Life starts with the first heartbeat 
-that life has rights (some)
-Abortion should be legal early in the pregnancy in cases of incest or medical issues with the baby (what medical issues?  Downs maybe?)
-abortion should be legal when the mother is in danger but if the baby is viable, all attempts should me made to save it

I’m really not looking for a fight.  I just need to bounce ideas off of people to triangulate to my position.

Edit: getting a lot of questions about why I consider life beginning at the heartbeat.  Technically I would say life begins at conception.  But i feel like you can’t really kill anything without a beating heart, it’s not alive yet.  It’s not scientific, it’s just how I feel...and that’s why I’m here, to flesh out my thoughts

Also, thanks for all of the responses.  Even the hostile ones have been helpful ",1521578671,51,2018-03-20 16:44:31
29,Flair options,4,True,"It has been suggested we add some new flairs, please post your ideas in  the comments. Note any comments violating rule 3 will be deleted and the submitter banned",1521222446,1,2018-03-16 13:47:26
31,Could we change the flair options?,4,True,"I understand, in a sub like this, how contentious it could be to have custom flair. I imagine though, there are some pro-choice, pro-child folks, perhaps some fellow clinic escorts, and maybe others who would like a better selection of flair options? ",1521140335,13,2018-03-15 14:58:55
34,Pup-a-thon abortion access fundraiser.,8,True,"https://bowl.nnaf.org/campaign/fund-texas-choice/c164437 If you have a dog and would like to help raise money for abortion access in texas, check out this link.",1521122821,0,2018-03-15 10:07:01
41,Annoyed by Pro-Choice Terminology,0,True,[deleted],1520990995,13,2018-03-13 21:29:55
42,need help,1,True,"a friend of mine has just found out that they are 26 weeks pregnant. they had no symptoms, are barely showing, and have always had irregular periods so there was no way for them to know until they went to the doctor. they are currently trying to raise up $3k to go to New Mexico to have an abortion. 

if you can help their cash app is $kitwish
if not, please keep them in your thoughts and prayers. ",1520974969,7,2018-03-13 17:02:49
46,Best articles defending abortion rights.,7,True,"These are the best articles defending abortion rights I have read.
1.)https://www.theatlantic.com/politics/archive/2012/10/richard-mourdock-mitt-romney-and-the-gop-defense-of-coerced-mating/264035/
2.) https://www.thenation.com/article/gender-equality-is-not-possible-without-abortion/
3.) https://www.salon.com/2015/04/24/i_am_pro_abortion_not_just_pro_choice_10_reasons_why_we_must_support_the_procedure_and_the_choice/
4.) https://www.telegraph.co.uk/women/life/women-having-abortions-contraception-doesnt-work/
5.) https://www.rawstory.com/2015/02/what-do-people-mean-when-they-say-they-disapprove-of-abortion-as-birth-control/
6.) https://www.thecut.com/2015/08/the-big-secret-of-abortion.html
7.) http://www.arcc-cdac.ca/action/legalizing-abortion-saves-lives.html
8,) https://jezebel.com/5972943/there-is-no-such-thing-as-a-pro-life-feminist
9.) https://whatever.scalzi.com/2012/10/25/a-fan-letter-to-certain-conservative-politicians/
10.) https://carafem.org/10-things-riskier-than-abortion/
11.) https://www.thecut.com/2014/10/theres-no-such-thing-as-a-bad-abortion.html
12.) https://www.theguardian.com/commentisfree/2014/oct/14/abortion-right-to-privacy-women-right-to-equality
13.) https://rewire.news/article/2009/11/03/what-if-my-mother-had-aborted-me/
14.) https://www.theguardian.com/commentisfree/2015/jul/15/planned-parenthood-videos-abortion-truths
15.) https://www.huffingtonpost.com/lizz-winstead/abortion-is-a-medical-procedure_b_2064176.html
16.) https://www.alternet.org/books/katha-pollitt-ending-pregnancy-common-normal-event-womens-lives-lets-talk-about-it-way
There are more of course, but these are my favorite.",1520900393,17,2018-03-12 20:19:53
49,Enforced abortions?,0,True,[removed],1520855769,2,2018-03-12 07:56:09
51,"I'm pro-life, convince me otherwise, not a troll post, just wondering what other side of argument is.",4,True,"title, I prefer you don't downvote, that would just reduce chances of others of seeing this and I'm legit trying to see why some are pro-choice.",1520839125,102,2018-03-12 03:18:45
56,Do psychological accounts of persons tacitly provide support for morally monstrous acts?,3,True,"It is commonly argued that a serious right to life is grounded only in actual, relatively advanced psychological capacities a being has acquired. The moral permissibility of abortion is frequently argued for on these grounds. Increasingly it is being argued that such accounts also entail the permissibility of infanticide, with several proponents of these theories accepting this consequence. 

However, these accounts imply the permissibility of even more unpalatable acts than infanticide performed on infants: organ harvesting, live experimentation, sexual interference, and discriminatory killing. The stronger intuitions against the permissibility of these ‘pre-personal acts’ allow us to re-establish a comprehensive and persuasive reductio against psychological accounts of persons.

The link to the whole paper which is currently Open Access is available here - https://www.tandfonline.com/doi/full/10.1080/20502877.2018.1438771

Would love to hear your thoughts and comments.",1520796007,26,2018-03-11 15:20:07
59,Monthly Pregnancy Testing Day,1,True,"I have seen many posts lately about women finding out too late that they are pregnant and our peeps stressing about such a possibility. I have come up with an idea. How about every woman here and for men, their partners, having a day set aside every month where they take pregnancy tests, just to put their minds at ease. I think it is a good idea. Tell me what you think in the comments.",1520724368,7,2018-03-10 18:26:08
61,What about the mother?,1,True,[deleted],1520629385,0,2018-03-09 16:03:05
63,About Crisis Pregnancy Centers,12,True,"Hello!  I'm posting a slightly modified version of [a post I made](https://np.reddit.com/r/childfree/comments/81s3tm/attn_mods_should_information_about_crisis/) over at r/childfree about crisis pregnancy centers.  It was suggested that the information could be useful here as well, and might be worth adding to this sub's wiki. 

There was a recent post on r/childfree about [a vandalized crisis pregnancy center](https://np.reddit.com/r/childfree/comments/81ljbx/crisis_pregnancy_center_pretending_to_be_abortion/), and I noticed a few users mentioning that they didn't know that the so-called ""women's/pregnancy  crisis centers"" in the USA and Canada existed.  They weren't aware that these centers work to lure in vulnerable women in order to pressure them to carry their pregnancies to term, instead of getting an abortion.

So I put together the following information and links about CPCs to help readers start learning. All of the info below is accurate and factual to the best of my knowledge:

1. **Crisis Pregnancy Centers (CPCs) are anti-abortion organizations that frequently masquerade as reproductive health clinics in order to lure pregnant women away from clinics that will provide them the option of reliable birth control and of safe and legal abortion.**  They aim to discourage and prevent women from seeking abortions’ in order [to fulfill their goal of ‘interfer[ing] with women’s ability to be fully informed and exercise their reproductive rights.’”](http://www.scotusblog.com/wp-content/uploads/2017/04/16-1140-op-bel-9th-cir.pdf)
1.  Despite what they imply in their names, advertising, and other branding, **most crisis pregnancy centers are NOT medical facilities of any sort.** Apart from providing free pregnancy tests and possibly limited sonograms, they do not offer medical assistance.
1. Most of the time, **CPCs are affiliated with anti-abortion groups run by intensely conservative religious denominations.**  These include, but aren't limited to,  [Birthright International](https://en.wikipedia.org/wiki/Birthright_International) and [Care Net](https://en.wikipedia.org/wiki/Care_Net).  These are groups committed to making sure you don't have an abortion, regardless of your circumstances.
1.  **CPCs insinuate heavily that they will help you get an abortion** if you desire, or will provide significant financial assistance if you want to carry to term. 
1. **In fact, these centers will pressure you to carry your pregnancy to term, even if you clearly express that you don't want to.**  The assistance they claim to offer is usually limited to a few months of things like diapers and formula.
1. **CPCs use heavy-handed and unethical tactics, including *lots* of emotional manipulation (shaming, guilting, etc.),  giving women incorrect, incomplete, or flat-out deceptive medical information (popularly  known as **LIES**), and tricking or otherwise preventing you from leaving the clinic until you make certain commitments.**  If you go to one, you may be forced to watch anti-abortion films, slide shows, photographs, and hear biased lectures
1. **CPCs work very hard to intercept you from going to a legitimate women's health center.  They use branding to make it sound like they offer abortions, birth control, and have qualified medical professionals on staff (they almost always don't).**  They offer free pregnancy testing to draw you in, so they can start exerting pressure.  They locate themselves next door or near to legitimate centers, they advertise where legitimate centers advertise, and they will list themselves under “abortion” in online directories and search results.
1. **If a CPC gets your personal information, [they may attempt to manipulate or harass you after you leave](https://www.cosmopolitan.com/politics/news/a43101/pregnancy-centers-august-2015/).**  There have been anecdotal reports of women receiving mailings and phone calls encouraging them not to have an abortion, or just discussing their pregnancy.  This is especially problematic for women who don't want their pregnancy revealed to certain people they may be living with.  Many CPCs convince women to sign a contract that they will carry their pregnancy to term, and then send it—with all of their personal information, including social security number—to every abortion provider nearby to try to scare both patients and real health care providers into refusing women care.
1. It's also worth noting that **some (many?) CPC's are fronts for adoption mills.**  Step 1 being to convince the woman to go through with the pregnancy, step 2 to convince her that she's a horrible person and unfit to be a parent so she ought to give up the baby for adoption. See [here](https://www.thenation.com/article/shotgun-adoption/) and [here](http://rhrealitycheck.org/article/2015/03/13/undercover-investigation-confirms-california-crisis-pregnancy-centers-lie-women/).  **Sometimes those places will hook you up with free medical care, housing, all kinds of stuff if AND ONLY IF you agree to place your baby for adoption.** There used to be a place in my state that would let mothers stay for six months after the birth of their child if they placed the baby for adoption (for free!) but only three weeks if they chose to parent.  Anyway, some CPCs make quite a bit of money off every woman they convince to both carry the pregnancy to term and give the baby to an adoption agency which charges sky high fees to the adopting parents.
1.  **It can be tough to identify a CPC.**  ""Crisis Pregnancy Center"" is still a fairly common name out there, but these places may also call themselves names such as ""Center for Pregnancy Choices"",  ""(insert religion here) Family Services"",  ""Pregnancy Resource Center"", “A Woman’s Concern Health Centers”, and “Life Choices Medical Clinics” (see [here](https://np.reddit.com/r/childfree/comments/81s3tm/attn_mods_should_information_about_crisis/dvfupf7/) for sources).  If you're unsure whether or not a given center is a CPC, you can visit [**Expose Fake Clinics**](https://exposefakeclinics.squarespace.com/cpc) to see if they're listed.  At [**SafePlaceProject.com**](https://www.safeplaceproject.com/), you can find legitimate clinics in your area.  And here is [a link to a list of all the Crisis Pregnancy Centres in Canada](http://www.arcc-cdac.ca/CPC-study/list-anti-choice-groups.pdf).


Certainly people with religious convictions who are dealing with an unintended pregnancy may want to consult with a group that shares those same religious convictions.  But those people deserve to know most CPCs will not be able to or willing to provide them the accurate medical information that they need in order to make *any* decisions.

Please visit these links to learn more about CPCs:

* [Wikipedia's entry on Crisis Pregnancy Centers](https://en.wikipedia.org/wiki/Crisis_pregnancy_center)
* [Why All Women Should Know About the Dangerous Mission of Crisis Pregnancy Centers](https://www.brides.com/story/why-all-women-should-know-about-the-dangerous-mission-of-crisis-pregnancy-centers) - Brides.com
* [Fake Health Centers](https://www.prochoiceamerica.org/issue/fake-health-centers/) - NARAL Pro Choice America. (PDF of their report [here](https://www.prochoiceamerica.org/wp-content/uploads/2016/12/6.-The-Truth-About-Crisis-Pregnancy-Centers.pdf))
* [The Fake Abortion Clinics of America](https://video.vice.com/en_us/video/fake-abortion-clinics/55e0dbc4ca0b0b2c784ce599_) - video documentary from Vice.com, about 18 minutes long
* [The Truth About Crisis Pregnancy Centers: These ""anti-choice"" facilities often masquerade as legitimate women's health clinics.](https://www.womenshealthmag.com/health/crisis-pregnancy-centers) - WomensHealthMag.com 
* [What Are ‘Crisis Pregnancy Centers,’ And Why Does The Supreme Court Care About Them? An anti-abortion scam, explained.](https://www.huffingtonpost.com/entry/crisis-pregancy-centers-supreme-court_us_5a09f40ae4b0bc648a0d13a2) - HuffPo
* [What I Learned Undercover at a Crisis Pregnancy Center](https://www.huffingtonpost.com/caitlin-bancroft/crisis-pregnancy-center_b_3763196.html) - HuffPo, and [How my job talking women out of abortions made me pro-choice](https://www.vox.com/2016/5/26/11760670/crisis-pregnancy-center) - Vox.  These are both very good articles that show what you can expect if you go to a CPC.
* [Why Are Crisis Pregnancy Centers Not Illegal?](http://www.slate.com/articles/double_x/doublex/2015/06/crisis_pregnancy_centers_three_legal_strategies_for_bringing_them_down.single.html) from Slate.",1520614582,123,2018-03-09 11:56:22
64,Society is free to support an embryo to live independent of mother,15,True,"Society can fund to help embryo to survive independently without mother’s nutrition supply. Pro-life people can generously donate. But an embryo can’t survive outside womb until 7th month, so it should not be considered as a living human. So abortion should be allowed till the 7th month.",1520571325,5,2018-03-08 23:55:25
67,Do anti choicers know that contraception can fail?,21,True,"In my discussions with anti choicers, a common statement that I always here from them is, "" women should be more responsible and use birth control."" Are they aware of the fact that ALL contraceptives, including sterilization, have a failure rate? Even abstinence has a failure rate due to rape. ",1520530007,45,2018-03-08 12:26:47
71,Conflicted,1,True,"I recently found out I’m 11 weeks pregnant ...

I was about to have an abortion but couldn’t go through with it ... I let my emotions get the best of me.   I was in the waiting room in the back sobbing and crying , wondering how I could terminate this little soul. 

I told my parents and they said they would support me but I live with my evil sister who enjoys torturing me.

The father is an alcoholic who was abusive towards me and told me immediately to get an abortion.


I don’t have a job ... no savings.  


Previous history of mental illness as far as emotional and social problems.

I feel like I should go through with the abortion because at the end of the day it’s my responsibility alone and I just don’t feel ready even though it tears me apart inside, and I’ve told some family members.  I live at home and I suppose I could fake a miscarriage ....
The father already had a child who is barely one years old and doesn’t care ... I’d be baby mama 2.

I have a college degree in Psychology from William and Mary....

I know I have potential but right now I am extremely sad and don’t know what to do... my parents immediately expressed relief at me not being a murderer ....

They are extremely conservative .


What do I do?


Deep down I think it’s foolish to  have a child with no real partner and no career .  My parents are in their mid sixties and I’m one of four kids in a highly enmeshed family.


My evil older sister who is 36 and still lives at home but is a filmmaker who travels around a lot is a huge thorn in my side.

I would feel so much happier knowing I got a way from everyone like that ... if I stayed I would have to deal with her brutal judgement all the time.


She insults me in passive aggressive ways but then acts nice to me in front of parents, she is the golden child while I’m the black sheep.  


I can’t do this but I’m also afraid of always wondering “what if” and the guilt is killing me.


I just don’t feel strong enough

My depression is so bad that I have barely gotten out of bed in two months after the baby’s father gave me a concussion and humiliated me... we have restraining orders on each other .  It’s ironic he turned out this way because he comes from a good family and his dad is an eye doctor .  So is mine . 


My life feels like a nightmare but everyone around me seems to think this child will be a joy, which I’m sure of.


I don’t feel mature at 27 to do this but I also feel maybe having a child could be my saving grace , a reason to change and live .  I’m so so heartbroken,

 ",1520452337,12,2018-03-07 14:52:17
76,If abortion has been illegal when you had one....,12,True,"For those of you who have had abortions, what do you think you would have done if it had been illegal? Do you think you would have still found a way? What do you think your life would be like if you had not been able to abort?",1520293868,6,2018-03-05 18:51:08
77,Why is it so difficult for women to not get pregnant?,0,True,"Why is it so hard to wear a condom, use spermicide(they even have ones with spermicide in them!) AND do the shots/pills/inserts?(or women can shut their legs...?) I mean, there are natural pregnancy prevention methods, though they aren't as effective as modern methods.

There will always be accidental pregnancies and legit reasons for late-term and regular abortions(Rape, incest, etc). I get that. There will always be babies who were simply 'meat to be born' IMO(not religious, I also think that babies who were miscarriages, might have been the next Hitler, who knows?) But it shouldn't take you months on end, after you've figured out you're pregnant, to decide whether you want the baby or not.

Also, enough people don't even realize they're pregnant, that they made a show about it.

I am fine with abortion, I just think it should be done as soon as it's found out. 

To people who say men should be the ones to prevent pregnancy-it takes two people(Excluding anomalies) to get pregnant. 

Edited majorly. ",1520287496,29,2018-03-05 17:04:56
78,Honest question,0,True,"I'd like to ask an honest question, and I'd like to get **mature** and non hysteric, non mean spirited answers.

When someone demonstrates they're not responsible enough to own a gun, we don't let them own one.   When someone demonstrates they're not responsible enough to drive a car, we don't let them drive one.   When someone demonstrates they're not responsible enough to drink alcohol, they're ordered to abstain.

When someone demonstrates they're not responsible enough to handle reproduction... why don't we follow similar suit?

FWIW... I am pro-life.. but not necessarily anti-abortion.   I think it should be available... but that it should come with consequences.   It seems to me that today, it comes with literally zero consequences, if not outright praise in some circles.  

Why don't we treat ""reproductive rights"" like other rights... that can be taken away if you abuse them or demonstrate you're not capable of handling them responsibly?",1520261616,85,2018-03-05 09:53:36
80,Tips on lobbying pro-life lawmakers?,8,True,"I live in a red state and am planning on visiting the capitol to go talk to pro-life legislators. I also love the power of storytelling, in terms of personal repro justice stories, that help humanize the issue. Any tips?",1520121992,2,2018-03-03 19:06:32
